Year,EmployerType,EmployerName,DepartmentOrSubdivision,Position,ElectedOfficial,Judicial,OtherPositions,MinPositionSalary,MaxPositionSalary,ReportedBaseWage,RegularPay,OvertimePay,LumpSumPay,OtherPay,TotalWages,DefinedBenefitPlanContribution,EmployeesRetirementCostCovered,DeferredCompensationPlan,HealthDentalVision,TotalRetirementAndHealthContribution,PensionFormula,EmployerURL,EmployerPopulation,LastUpdatedDate,EmployerCounty,SpecialDistrictActivities,IncludesUnfundedLiability,SpecialDistrictType
2011,State Department,Delta Protection Commission,,Executive Director/Delta Protection Commission,,,"Member, Board Of Directors/State Compensation Insurance",100428,108636,,152166,0,0,1541,153707,3234,0,0,11852,15086,PART-TIME SEASONAL AND TEMPORARY (PST) RETIREMENT PLAN,https://www.calhr.ca.gov,,07/01/2014,,,,
2011,State Department,Delta Protection Commission,,"Associate Governmental Program Analyst, Range A",,,,52800,64176,,58286,4087,0,0,62374,11061,0,0,14917,25979,2.00% @ 55,https://www.calhr.ca.gov,,07/01/2014,,,,
2011,State Department,Delta Protection Commission,,"Environmental Planner, Range C",,,,46092,56040,,43154,321,0,0,43476,0,0,0,5505,5505,ALTERNATE RETIREMENT PLAN (ARP),https://www.calhr.ca.gov,,07/01/2014,,,,
2011,State Department,Delta Protection Commission,,"Environmental Planner, Range C",,,,46092,56040,,43065,0,0,0,43065,0,0,0,5522,5522,ALTERNATE RETIREMENT PLAN (ARP),https://www.calhr.ca.gov,,07/01/2014,,,,
2011,State Department,Delta Protection Commission,,"Student Assistant, Range D",,,,21588,23292,,16787,0,0,0,16787,212,0,0,,212,2.00% @ 55,https://www.calhr.ca.gov,,07/01/2014,,,,
2011,State Department,Delta Protection Commission,,Staff Services Manager II (Managerial),,,,74076,81696,,3457,0,0,0,3457,0,0,0,,0,,https://www.calhr.ca.gov,,07/01/2014,,,,

